{
  "report_id": "GAP-CH2-20260605",
  "chapter": "CH2",
  "generated_at": "2026-06-05T00:12:54Z",
  "claims": [
    {
      "claim_id": "c001",
      "claim_text": "Математическая модель и метод оценки состояния",
      "claim_type": "theoretical_claim",
      "citation_need": "recommended",
      "gap_status": "missing",
      "recommended_evidence_role": "definition",
      "risk_level": "high",
      "reason": "Утверждение относится к теоретической основе (theoretical_claim). Требуется ссылка на источник теории или определения.",
      "matched_source_id": null,
      "evidence_strength": "none",
      "recommended_action": "Find source for theoretical claim: search literature databases for relevant evidence",
      "recommended_query": "Математическая модель метод оценки состояния"
    },
    {
      "claim_id": "c002",
      "claim_text": "Оценка технического состояния трансмиссии мобильных машин является актуальной задачей, поскольку внезапные отказы приводят к значительнымам и простою оборудования.",
      "claim_type": "descriptive_claim",
      "citation_need": "not_needed",
      "gap_status": "not_needed",
      "recommended_evidence_role": "definition",
      "risk_level": "low",
      "reason": "Утверждение является описательным (descriptive_claim). Обычно не требует цитирования, кроме случаев с конкретными методами или данными.",
      "matched_source_id": null,
      "evidence_strength": "none"
    },
    {
      "claim_id": "c003",
      "claim_text": "Традиционные методы диагностики основаны на анализе виброакустических сигналов, которые несут информацию о текущем состоянии элементов передачи.",
      "claim_type": "theoretical_claim",
      "citation_need": "recommended",
      "gap_status": "missing",
      "recommended_evidence_role": "definition",
      "risk_level": "high",
      "reason": "Утверждение относится к теоретической основе (theoretical_claim). Требуется ссылка на источник теории или определения.",
      "matched_source_id": null,
      "evidence_strength": "none",
      "recommended_action": "Find source for theoretical claim: search literature databases for relevant evidence",
      "recommended_query": "Традиционные методы диагностики основаны анализе виброакустических сигналов которые"
    },
    {
      "claim_id": "c004",
      "claim_text": "Динамическая модель трансмиссии",
      "claim_type": "theoretical_claim",
      "citation_need": "recommended",
      "gap_status": "missing",
      "recommended_evidence_role": "definition",
      "risk_level": "high",
      "reason": "Утверждение относится к теоретической основе (theoretical_claim). Требуется ссылка на источник теории или определения.",
      "matched_source_id": null,
      "evidence_strength": "none",
      "recommended_action": "Find source for theoretical claim: search literature databases for relevant evidence",
      "recommended_query": "Динамическая модель трансмиссии"
    },
    {
      "claim_id": "c005",
      "claim_text": "Рассматривается многоступенчатая зубчатая передача, динамика которой описывается системой нелинейных дифференциальных уравнений.",
      "claim_type": "descriptive_claim",
      "citation_need": "not_needed",
      "gap_status": "not_needed",
      "recommended_evidence_role": "definition",
      "risk_level": "low",
      "reason": "Утверждение является описательным (descriptive_claim). Обычно не требует цитирования, кроме случаев с конкретными методами или данными.",
      "matched_source_id": null,
      "evidence_strength": "none"
    },
    {
      "claim_id": "c006",
      "claim_text": "Основные параметры модели включают приведённую жёсткость зацепления, коэффициент демпфирования и моменты инерции звеньев.",
      "claim_type": "theoretical_claim",
      "citation_need": "recommended",
      "gap_status": "missing",
      "recommended_evidence_role": "definition",
      "risk_level": "high",
      "reason": "Утверждение относится к теоретической основе (theoretical_claim). Требуется ссылка на источник теории или определения.",
      "matched_source_id": null,
      "evidence_strength": "none",
      "recommended_action": "Find source for theoretical claim: search literature databases for relevant evidence",
      "recommended_query": "Основные параметры модели включают приведённую жёсткость зацепления коэффициент"
    },
    {
      "claim_id": "c007",
      "claim_text": "Уравнения движения записываются в стандартной форме:",
      "claim_type": "descriptive_claim",
      "citation_need": "not_needed",
      "gap_status": "not_needed",
      "recommended_evidence_role": "definition",
      "risk_level": "low",
      "reason": "Утверждение является описательным (descriptive_claim). Обычно не требует цитирования, кроме случаев с конкретными методами или данными.",
      "matched_source_id": null,
      "evidence_strength": "none"
    },
    {
      "claim_id": "c008",
      "claim_text": "M * q'' + C * q' + K(t) * q = F(t)",
      "claim_type": "descriptive_claim",
      "citation_need": "not_needed",
      "gap_status": "not_needed",
      "recommended_evidence_role": "definition",
      "risk_level": "low",
      "reason": "Утверждение является описательным (descriptive_claim). Обычно не требует цитирования, кроме случаев с конкретными методами или данными.",
      "matched_source_id": null,
      "evidence_strength": "none"
    },
    {
      "claim_id": "c009",
      "claim_text": "где M — матрица масс, C — матрица демпфирования, K(t) — переменная матрица жёсткости зацепления, зависящая от угла поворота.",
      "claim_type": "descriptive_claim",
      "citation_need": "not_needed",
      "gap_status": "not_needed",
      "recommended_evidence_role": "definition",
      "risk_level": "low",
      "reason": "Утверждение является описательным (descriptive_claim). Обычно не требует цитирования, кроме случаев с конкретными методами или данными.",
      "matched_source_id": null,
      "evidence_strength": "none"
    },
    {
      "claim_id": "c010",
      "claim_text": "Для оценки неизвестных параметров модели (жёсткость, демпфирование) используется расширенный фильтр Калмана (EKF).",
      "claim_type": "theoretical_claim",
      "citation_need": "optional",
      "gap_status": "partial",
      "recommended_evidence_role": "definition",
      "risk_level": "high",
      "reason": "Утверждение относится к теоретической основе (theoretical_claim). Требуется ссылка на источник теории или определения.",
      "matched_source_id": null,
      "evidence_strength": "weak"
    },
    {
      "claim_id": "c011",
      "claim_text": "Выбор EKF обусловлен его вычислительной эффективностью по сравнению с UKF при приемлемой точности для данной задачи.",
      "claim_type": "evaluative_claim",
      "citation_need": "recommended",
      "gap_status": "missing",
      "recommended_evidence_role": "benchmark",
      "risk_level": "medium",
      "reason": "Утверждение содержит оценочное суждение (evaluative_claim). Требуется ссылка на базовую литературу или экспериментальные данные.",
      "matched_source_id": null,
      "evidence_strength": "none",
      "recommended_action": "Find source for evaluative claim: search literature databases for relevant evidence",
      "recommended_query": "Выбор обусловлен вычислительной эффективностью сравнению приемлемой точности данной"
    },
    {
      "claim_id": "c012",
      "claim_text": "Алгоритм расширенного фильтра Калмана",
      "claim_type": "method_claim",
      "citation_need": "required",
      "gap_status": "missing",
      "recommended_evidence_role": "method_basis",
      "risk_level": "high",
      "reason": "Утверждение описывает конкретный метод или алгоритм (method_claim). Требуется ссылка на оригинальную публикацию метода.",
      "matched_source_id": null,
      "evidence_strength": "none",
      "recommended_action": "Find source for method claim: search literature databases for relevant evidence",
      "recommended_query": "Алгоритм расширенного фильтра Калмана"
    },
    {
      "claim_id": "c013",
      "claim_text": "Процедура EKF состоит из двух этапов: предсказание и коррекция.",
      "claim_type": "descriptive_claim",
      "citation_need": "not_needed",
      "gap_status": "not_needed",
      "recommended_evidence_role": "definition",
      "risk_level": "low",
      "reason": "Утверждение является описательным (descriptive_claim). Обычно не требует цитирования, кроме случаев с конкретными методами или данными.",
      "matched_source_id": null,
      "evidence_strength": "none"
    },
    {
      "claim_id": "c014",
      "claim_text": "На этапе предсказания производится линеаризация нелинейной модели относительно текущей оценки состояния.",
      "claim_type": "theoretical_claim",
      "citation_need": "recommended",
      "gap_status": "missing",
      "recommended_evidence_role": "definition",
      "risk_level": "high",
      "reason": "Утверждение относится к теоретической основе (theoretical_claim). Требуется ссылка на источник теории или определения.",
      "matched_source_id": null,
      "evidence_strength": "none",
      "recommended_action": "Find source for theoretical claim: search literature databases for relevant evidence",
      "recommended_query": "этапе предсказания производится линеаризация нелинейной модели относительно текущей"
    },
    {
      "claim_id": "c015",
      "claim_text": "Матрица Якоби вычисляется аналитически для модели зубчатой передачи.",
      "claim_type": "theoretical_claim",
      "citation_need": "recommended",
      "gap_status": "missing",
      "recommended_evidence_role": "definition",
      "risk_level": "high",
      "reason": "Утверждение относится к теоретической основе (theoretical_claim). Требуется ссылка на источник теории или определения.",
      "matched_source_id": null,
      "evidence_strength": "none",
      "recommended_action": "Find source for theoretical claim: search literature databases for relevant evidence",